ID;Contents
equipment_effectdiscription_suitempower01;장착한 히어로의 방어력을 10% 상승 시킨다.
equipment_effectdiscription_suitempower02;장착한 히어로의 방어력을 20% 상승 시킨다.
equipment_effectdiscription_suitempower03;장착한 히어로의 방어력을 30% 상승 시킨다.
herodiscription_stardus;스타더스 설명 (추후 추가)
herodiscription_egostick;에고스틱 설명 (추후추가)
herodiscription_rockbottom;락버텀 설명 (추후추가)
herodiscription_shadowwalker;설명 (추후추가)
herodiscription_southsilver;설명 (추후추가)
herodiscription_icicle;설명 (추후추가)
herodiscription_third;설명 (추후추가)
herodiscription_forth;설명 (추후추가)
herodiscription_saintess;설명 (추후추가)
skillinfo_Star_a;주먹으로 적을 타격합니다. 별빛의 힘이 범위 내의 적을 함께 타격합니다. 공격력의 n% 피해를 입힙니다.
skillinfo_Star_p;별빛의 기운이 몸을 휘감아 공격 속도가 n% 증가합니다.
skillinfo_Star_s;별의 기운을 주먹에 모아 적에게 강력한 피해를 입힙니다. 공격력의 n% 피해를 입힙니다
skillinfo_Shadow_a;바닥에서 솟아오르는 그림자를 이용해 적을 공격합니다. 적에게 n% 피해를 입힙니다.
skillinfo_Shadow_p;예상치 못한 곳에서 등장해 공격하는 쉐도우워커는 적에게 치명적인 피해를 입힙니다. 공격력이 n% 만큼 증가합니다.
skillinfo_Shadow_s;지정 범위에 그림자의 늪을 깔아, 범위의 적에게 지속시간 동안 초당 공격력의 n% 데미지를 입힙니다.
skillinfo_saintess_a;체력이 가장 낮은 아군의 체력을 공격력의 n%만큼 회복시킵니다
skillinfo_saintess_p;아군의 최대 체력을 n% 증가시킵니다
skillinfo_saintess_s;전체 아군에게 5초 간 지속되는 방어막을 생성, 방어막은 공격력의 n%만큼의 피해를 흡수합니다
skillinfo_Rockbottom_a;전방에 있는 적을 공격합니다. 공격력의 n% 피해를 줍니다.
skillinfo_Rockbottom_p;바위를 몸에 둘러 튼튼한 갑옷을 형성합니다. 방어력이 n% 증가합니다.
skillinfo_Rockbottom_s;바위를 몸에 두르고 목표 지점으로 도약합니다. 착지와 동시에 큰 충격파를 일으키며, 범위 안의 적을 도발합니다. 공격력의 n% 피해를 입힙니다.
skillinfo_ego_a;염동력으로 총을 띄워, 예측하지 못한 곳에서 적을 공격합니다. 공격력의 n% 피해를 입힙니다
skillinfo_ego_p;에고스틱이 8초마다 에너지 충전 스택을 획득합니다. 액티브 스킬 사용시 모든 스택을 소모하여 스택 수에 비례해 액티브 스킬의 피해량이 증가합니다
skillinfo_ego_s;염동력으로 넓은 범위의 적을 무력화합니다. 범위 내의 적에게 공격력의 n% 피해를 입히고, 에너지 충전 스택이 5스택 이상일 때 사용 시 적에게 3초간 지속되는 기절 상태이상을 부여합니다. 에너지 충전 스택이 3스택 이하일 때 사용 시 본인에게 출혈 상태이상을 부여합니다.
skillinfo_southsilver_a;일정 범위 내의 아군을 지원합니다. 범위 내 아군의 체력을 자신의 최대 체력의 n% 회복합니다.
skillinfo_southsilver_p;작전을 시작하기 전, 적에 대한 정보를 분석합니다. 모든 아군의 공격력이 n% 증가합니다.
skillinfo_southsilver_s;새로 개발한 신형 전투 로봇들을 출격합니다. 로봇은 30초 간 전투를 지원합니다.
skillinfo_icicle_a;허공에서 얼음의 창을 생성하여 단일 적에게 공격력 n%의 피해를 입힙니다
skillinfo_icicle_p;3초에 한 번 가장 가까운 적에게 5초간 빙결 상태로 만들어 공격속도를 n% 감소시킵니다
skillinfo_icicle_s;얼음으로 이루어진 비를 내려 범위 내 모든 적에게 자신의 공격력 n%의 피해를 입히고 5초간 공격속도 감소를 발생시킵니다
skillinfo_forth_a;적에게 물방울을 발사해 공격력의 n%의 피해를 입히며, 대상의 공격력을 n% 감소시킵니다. ( 중첩 불가능 )
skillinfo_forth_p;아군의 공격속도를 n% 상승시킵니다
skillinfo_forth_s;물 안개를 해당 지점에 소환, 10초간 안개 범위 내의 아군을 초당 공격력의 n%만큼의 체력을 회복시킵니다
skillinfo_third_a;거대한 대검을 휘둘러 범위 내 3명의 적에게 공격력 n%의 피해를 입힙니다
skillinfo_third_p;신체를 강화하여 공격속도 n% 및 공격력 n%를 상승시킵니다
skillinfo_third_s;지속시간 동안 주변적에게 초당 공격력 n%의 피해를 입힙니다
item_info_gold;골드
item_info_crystal;크리스탈
item_info_gacha_scrollnomal;어쩐지 내가 좋아하는 히어로를 만날 수 있을 것 같다.
item_info_pinkstone;분홍빛의 작은 다이아몬드 원석. 사격형 히어로가 좋아할 것 같다.
item_info_pinkdiamond;빛나는 분홍 다이아몬드. 사격형 히어로가 좋아할 것 같다.
item_info_pinkdiabunch;엄청난 크기의 분홍 다이아몬드 덩어리. 사격형 히어로가 좋아할 것 같다.
item_info_purplestone;보라빛의 작은 다이아몬드 원석. 여러 개를 모아 쓸 일이 있을 것 같다.
item_info_purplediamond;빛나는 보라 다이아몬드. 방어형 히어로가 좋아할 것 같다.
item_info_purplediabunch;엄청난 크기의 보라 다이아몬드 덩어리. 방어형 히어로가 좋아할 것 같다.
item_info_bluestone;하늘빛의 작은 다이아몬드 원석. 여러 개를 모아 쓸 일이 있을 것 같다.
item_info_bluediamond;빛나는 하늘색 다이아몬드. 지원형 히어로가 좋아할 것 같다.
item_info_bluediabunch;엄청난 크기의 하늘색 다이아몬드 덩어리. 지원형 히어로가 좋아할 것 같다.
item_info_greenstone;초록빛의 작은 다이아몬드 원석. 여러 개를 모아 쓸 일이 있을 것 같다.
item_info_greendiamond;빛나는 초록 다이아몬드. 돌격형 히어로가 좋아할 것 같다.
item_info_greendiabunck;엄청난 크기의 초록 다이아몬드 덩어리. 돌격형 히어로가 좋아할 것 같다.
item_info_graystone;회색빛의 작은 다이아몬드 원석. 여러 개를 모아 쓸 일이 있을 것 같다.
item_info_graydiamond;빛나는 회색 다이아몬드. 은밀형 히어로가 좋아할 것 같다.
item_info_graydiabunch;엄청난 크기의 회색 다이아몬드 덩어리. 은밀형 히어로가 좋아할 것 같다.
item_info_cookie;먹음직스러운 쿠키. 담백한 맛을 좋아하는 히어로들이 있을 지도 모른다.
item_info_candy;빨간 막대 사탕. 달달한 걸 좋아하는 히어로들이 있을 지도 모른다.
item_info_ribbon;머리묶기에 용이한 리본, 머리가 긴 히어로들이 필요할지도 모르니 갖고다니자.
item_info_mask;용기있는 히어로들은 가끔 혼자만의 시간이 필요하다. 마스크를 좋아할지도 몰라.
item_info_pipe;아기자기한 크기의 피리. 여린 히어로들이 좋아할 것 같다.
item_info_doll;인형을 좋아하는 요상한 히어로가 있을지도 모른다.
item_info_minigoldbox;골드가 들어있는 꾸러미
item_info_goldbox;골드가 많이 들어있는 꾸러미
item_info_biggoldbox;엄청난 양의 골드가 들어있는 꾸러미
item_info_minicrystalbox;크리스탈이 들어있는 꾸러미
item_info_crystalbox;크리스탈이 많이 들어있는 꾸러미
item_info_bigcrystalbox;엄청난 양의 크리스탈이 들어있는 꾸러미
item_info_grade_stardus;스타더스의 승급에 사용된다.
item_info_grade_egostick;에고스틱의 승급에 사용된다.
item_info_grade_rockbottom;락바텀의 승급에 사용된다.
item_info_grade_shadowwalker;쉐도우워커의 승급에 사용된다.
item_info_grade_southsilver;한서은의 승급에 사용된다.
item_info_grade_icicle;이설아의 승급에 사용된다.
item_info_grade_third;허다희의 승급에 사용된다.
item_info_grade_forth;산수아의 승급에 사용된다.
item_info_grade_saintess;이하율의 승급에 사용된다.
item_info_grade_usually;모든 히어로의 승급에 사용된다.
item_info_grade_manneung;만능 영혼석의 재료로, 10개를 모으면 만능영혼석이 된다.
item_info_gacha_scrollgreen;멋진 히어로들과 계약할 수 있다.
item_info_gacha_scrollgold;강력한 히어로들과 계약할 수 있다.
operation_info_hotel;테러범들이 호텔을 습격했다. 투숙객들이 위험해지기 전에 빠르게 퇴치하자
operation_info_fanatic;빌런의 수하를 자처하는 범죄자들을 퇴치하자
operation_info_shintia;헛소문을 퍼트리는 빌런 조직이 나타났다. 빠르게 제압하자
operation_info_hanenskimish;한은 그룹이 온갖 비인도적인 실험을 자행했다는 정보를 입수했다. 사실인지 조사해야 한다
operation_info_hanen;한은 그룹의 범죄 사실이 모두 밝혀졌다, 한은 그룹을 제압해야 한다
operation_info_moonskimish;자신들을 월광교라고 부르는 범죄자들이 나타났다. 피해가 커지기 전에 퇴치해야 한다
operation_info_moon;월광교의 목적은 세계의 틈을 무너트려 괴수들을 불러내는 것임이 밝혀졌다. 월광교를 저지해야 한다
operation_info_demonskimish;무역센터가 정체불명의 검은 물질에 뒤덮혔다. 무역센터를 조사해야 한다
operation_info_hanenbasement;한은 그룹의 연구소로 추정되는 지하 시설이 발견되었다. 지하 시설을 조사해야 한다
operation_info_moonpontiff;월광교의 수뇌부로 보이는 빌런이 나타났다. 빌런을 제압하고 서울을 지켜내야 한다
operation_info_demon;무역 센터를 뒤덮은 정체 불명의 물질은 '데몬즈'라 불리는 빌런의 소행임이 밝혀졌다. 빌런을 퇴치하고 무역 센터를 되찾아야 한다
